{
  "event_id": "10000000-0000-4000-8000-000000000001",
  "event_type": "goat.identifier.added",
  "schema_version": "1.0.0",
  "schema_ref": "contracts/jsonschema/domain-event-envelope.schema.json",
  "aggregate_type": "goat",
  "aggregate_id": "aaaaaaaa-aaaa-4aaa-8aaa-aaaaaaaaaaa1",
  "subject_type": "identifier",
  "subject_id": "44444444-4444-4444-8444-444444444444",
  "occurred_at": "2026-01-15T09:30:00Z",
  "recorded_at": "2026-01-15T09:30:03Z",
  "producer": {
    "service": "goat-ops-core",
    "module": "identity",
    "version": "goatos-contract-v1"
  },
  "idempotency_key": "synthetic-animal-id-row-0001-v1",
  "actor": {
    "actor_type": "import_job",
    "actor_id": null,
    "actor_ref": "synthetic_phase1_fixture"
  },
  "visibility_scope": {
    "tenant_id": "11111111-1111-4111-8111-111111111111",
    "custodian_party_id": "22222222-2222-4222-8222-222222222222",
    "farm_id": "33333333-3333-4333-8333-333333333333",
    "park_id": "55555555-5555-4555-8555-555555555555",
    "shed_id": "66666666-6666-4666-8666-666666666666",
    "cohort_id": null
  },
  "evidence_refs": [
    {
      "evidence_type": "source_record",
      "evidence_id": "synthetic-animal-id-row-0001",
      "source_system": "synthetic_goatos_fixture",
      "description": "Fake Animal ID row used only for contract validation."
    },
    {
      "evidence_type": "identifier",
      "evidence_id": "44444444-4444-4444-8444-444444444444",
      "source_system": null,
      "description": "Synthetic active Animal ID identifier."
    }
  ],
  "payload": {
    "goat_id": "aaaaaaaa-aaaa-4aaa-8aaa-aaaaaaaaaaa1",
    "identifier_id": "44444444-4444-4444-8444-444444444444",
    "identifier_type": "animal_identifier_1",
    "identifier_value": "AID_EXAMPLE_000001",
    "scope_key": "global",
    "status": "active"
  },
  "trace_id": "trace-synthetic-phase1-0001",
  "replay": {
    "is_replay": false,
    "replay_of_event_id": null,
    "dlq_repair_id": null,
    "attempt": null
  }
}
